{
  "version": "1.0",
  "project_root": "..",
  "weavers": {
    "spider-sdlc": {
      "format": "Spider",
      "path": "weavers/sdlc"
    }
  },
  "systems": [
    {
      "name": "Spider",
      "slug": "spider",
      "weaver": "spider-sdlc",
      "artifacts": [
        { "name": "Product Requirements", "path": "architecture/PRD.md", "kind": "PRD", "traceability": "FULL" },
        { "name": "Overall Design", "path": "architecture/DESIGN.md", "kind": "DESIGN", "traceability": "FULL" },
        { "name": "ADR-0001: Initial Architecture", "path": "architecture/ADR/general/0001-spd-spider-adr-initial-architecture-v1.md", "kind": "ADR", "traceability": "FULL" },
        { "name": "ADR-0002: Adaptive Spider", "path": "architecture/ADR/general/0002-spd-spider-adr-adaptive-spider-flow-driven-development-v1.md", "kind": "ADR", "traceability": "FULL" },
        { "name": "ADR-0003: Template-Centric", "path": "architecture/ADR/general/0003-spd-spider-adr-template-centric-architecture-v1.md", "kind": "ADR", "traceability": "FULL" },
        { "name": "Design Decomposition", "path": "architecture/DECOMPOSITION.md", "kind": "DECOMPOSITION", "traceability": "FULL" },
        { "name": "Spec: Template System", "path": "architecture/specs/template-system.md", "kind": "SPEC", "traceability": "DOCS-ONLY" }
      ],
      "codebase": [
        {
          "name": "Spider CLI",
          "path": "skills/spider/scripts/spider",
          "extensions": [".py"],
          "singleLineComments": ["#"],
          "multiLineComments": [{"start": "\"\"\"", "end": "\"\"\""}]
        }
      ],
      "children": []
    }
  ]
}
