{
  "version": "1.0",
  "project_root": "..",
  "weavers": {
    "spaider-sdlc": {
      "format": "Spaider",
      "path": "weavers/sdlc"
    }
  },
  "systems": [
    {
      "name": "Spaider",
      "slug": "spaider",
      "weaver": "spaider-sdlc",
      "artifacts": [
        { "name": "Product Requirements", "path": "architecture/PRD.md", "kind": "PRD", "traceability": "FULL" },
        { "name": "Overall Design", "path": "architecture/DESIGN.md", "kind": "DESIGN", "traceability": "FULL" },
        { "name": "ADR-0001: Initial Architecture", "path": "architecture/ADR/general/0001-spd-spaider-adr-initial-architecture-v1.md", "kind": "ADR", "traceability": "FULL" },
        { "name": "ADR-0002: Adaptive Spaider", "path": "architecture/ADR/general/0002-spd-spaider-adr-adaptive-spaider-flow-driven-development-v1.md", "kind": "ADR", "traceability": "FULL" },
        { "name": "ADR-0003: Template-Centric", "path": "architecture/ADR/general/0003-spd-spaider-adr-template-centric-architecture-v1.md", "kind": "ADR", "traceability": "FULL" },
        { "name": "Design Decomposition", "path": "architecture/DECOMPOSITION.md", "kind": "DECOMPOSITION", "traceability": "FULL" },
        { "name": "Spec: Template System", "path": "architecture/specs/template-system.md", "kind": "SPEC", "traceability": "DOCS-ONLY" }
      ],
      "codebase": [
        {
          "name": "Spaider CLI",
          "path": "skills/spaider/scripts/spaider",
          "extensions": [".py"],
          "singleLineComments": ["#"],
          "multiLineComments": [{"start": "\"\"\"", "end": "\"\"\""}]
        }
      ],
      "children": []
    }
  ]
}
